,url,headline,is_paid,date_published,channel,original_headline,newspaper,corona_score,vaccine
430,https://www.spiegel.de/wissenschaft/medizin/corona-news-am-freitag-die-wichtigsten-entwicklungen-zu-sars-cov-2-und-covid-19-a-376ccec3-99cb-4efe-9ea8-9188ff3bfe74,corona news freitag brandenburg kündigen ausgangsbeschränkungen ostern,False,2021-03-26,Wissenschaft,Corona News am Freitag Brandenburg kündigt Ausgangsbeschränkungen über Ostern an,Der Spiegel,1.0,n/a
432,https://www.spiegel.de/politik/ausland/joe-bidens-erste-pressekonferenz-erst-euphorisch-dann-vage-dann-genervt-a-89c04f4b-7449-44af-b7eb-24d386295362,joe bidens erste pressekonferenz erst euphorisch vage nerven,False,2021-03-26,Politik,Joe Bidens erste Pressekonferenz Erst euphorisch dann vage dann genervt,Der Spiegel,0.75,n/a
433,https://www.spiegel.de/politik/deutschland/lobbyisten-bundestag-beschliesst-register-fuer-interessenvertreter-a-17516483-08b9-43da-9a6a-dfc4e6ce2c78,bundestag beschließen register lobbyisten müssen künftig registrieren,False,2021-03-26,Politik,Bundestag beschließt Register Lobbyisten müssen sich künftig registrieren,Der Spiegel,0.7142857142857143,n/a
436,https://www.spiegel.de/politik/deutschland/eu-videogipfel-ein-bisschen-hoffnung-im-corona-kampf-a-23483818-40d5-4a22-8a9d-3c6005479028,eu videogipfel bisschen hoffnung coronakampf,False,2021-03-26,Politik,EU Videogipfel Ein bisschen Hoffnung im Coronakampf,Der Spiegel,0.6,n/a
440,https://www.spiegel.de/politik/ausland/bundeswehr-bundestag-beschliesst-verlaengerung-des-einsatzes-in-afghanistan-a-02333da1-561f-4b9b-93ac-efd55fc209a5,beschluss bundestag afghanistan einsatz bundeswehr verlängern,False,2021-03-26,Politik,Beschluss im Bundestag Afghanistan Einsatz der Bundeswehr wird verlängert,Der Spiegel,1.0,n/a
443,https://www.spiegel.de/politik/ausland/belarus-mehr-als-hundert-festnahmen-bei-protesten-gegen-alexander-lukaschenko-a-45345d12-8cd5-4077-9bb2-fc35a96a4b8b,belarus mehr hundert festnahmen protesten lukaschenkos regime,False,2021-03-27,Politik,Belarus Mehr als hundert Festnahmen bei Protesten gegen Lukaschenkos Regime,Der Spiegel,0.7142857142857143,n/a
445,https://www.spiegel.de/panorama/zeitumstellung-2021-die-uhren-wurden-auf-sommerzeit-umgestelltrgestellt-a-bedd7468-bd4d-4469-83d7-ce5da3072b06,nacht sonntag uhren werden umstellen,False,2021-03-27,Panorama,In der Nacht auf Sonntag Die Uhren wurden umgestellt,Der Spiegel,0.6,n/a
446,https://www.spiegel.de/politik/ausland/corona-in-osteuropa-die-dritte-pandemiewelle-trifft-polen-tschechien-und-ungarn-hart-a-01587bc8-b2c0-4608-bef4-510755b70f66,corona osteuropa bergamo ungarn,False,2021-03-27,Politik,Corona in Osteuropa Bergamo in Ungarn,Der Spiegel,1.0,n/a
447,https://www.spiegel.de/politik/deutschland/mecklenburg-vorpommern-verschaerft-coronamassnahmen-ausgangsbeschraenkungen-moeglich-a-dd74d240-a7dd-4817-917e-cfb1c3ea4a30,dritt wellen deutschland mecklenburg vorpommern verschärfen coronamaßnahmen,False,2021-03-27,Politik,Dritte Welle in Deutschland Mecklenburg Vorpommern verschärft Coronamaßnahmen,Der Spiegel,0.7142857142857143,n/a
452,https://www.spiegel.de/politik/deutschland/olaf-scholz-spd-kanzlerkandidat-spricht-sich-fuer-gemeinsame-eu-armee-aus-a-fe1c9fad-a738-463c-ba0a-f5319adccbd6,spd kanzlerkandidat olaf scholz sprechen eu armee,False,2021-03-27,Politik,SPD Kanzlerkandidat Olaf Scholz spricht sich für EU Armee aus,Der Spiegel,0.8571428571428571,n/a
454,https://www.spiegel.de/politik/ausland/fast-90-tote-bislang-blutigster-tag-seit-beginn-der-proteste-in-myanmar-a-78535561-5c58-425c-b588-e18ba4530c47,seit beginn proteste bislang blutig tag myanmar mindestens 89 tot,False,2021-03-27,Politik,Seit Beginn der Proteste Bislang blutigster Tag in Myanmar mit mindestens 89 Toten,Der Spiegel,0.8,n/a
457,https://www.spiegel.de/politik/ausland/uno-fluechtlingshilfswerk-zaehlt-hunderte-mutmassliche-pushbacks-a-01b3fb03-0af7-4643-aa48-e217729716eb,griechenland setzen menschen meer uno flüchtlingshilfswerk zählen hunderte mutmaßlich pushbacks,False,2021-03-27,Politik,Griechenland setzt Menschen auf dem Meer aus Uno Flüchtlingshilfswerk zählt Hunderte mutmaßliche Pushbacks,Der Spiegel,0.7,n/a
459,https://www.spiegel.de/politik/ausland/tansania-samia-suluhu-hassan-ist-eine-chance-fuer-das-land-a-f5fed0eb-eef9-49e8-92f0-80bfe0c9007c,erste frau spitz chance tansania,False,2021-03-27,Politik,Erste Frau an der Spitze Eine Chance für Tansania,Der Spiegel,0.8,n/a
460,https://www.spiegel.de/wissenschaft/medizin/corona-gibt-es-einen-treiber-der-pandemie-a-a6ff7a40-26bb-4732-9657-e732024f191c,drosten ciesek antworten geben treiber pandemie,False,2021-03-27,Wissenschaft,Drosten und Ciesek antworten Gibt es Treiber der Pandemie,Der Spiegel,1.0,n/a
462,https://www.spiegel.de/politik/deutschland/coronavirus-jens-spahn-spricht-sich-fuer-richtiges-runterfahren-aus-a-4640db00-d9a4-48d2-99af-3faf740d8f93,dritt wellen deutschland spahn sprechen richtig runterfahren,False,2021-03-27,Politik,Dritte Welle in Deutschland Spahn spricht sich für richtiges Runterfahren aus,Der Spiegel,1.0,n/a
465,https://www.spiegel.de/panorama/coronavirus-und-pflegeheime-nach-der-impfung-ein-wenig-mehr-freiheit-a-3622cc7d-ec92-4d0d-866f-e51b5a9f188d,pflegeheime impfung neue frau kniffeln finden,False,2021-03-27,Panorama,Pflegeheime nach der Impfung Ich habe jetzt eine neue Frau zum Kniffeln gefunden,Der Spiegel,1.0,n/a
466,https://www.spiegel.de/auto/pop-up-radwege-wer-gewinnt-den-platzstreit-in-deutschlands-staedten-a-7009dd95-b5c5-4175-9e1f-3e760ff42f5b,platzstreit deutschlands städten fahrrad suchen,False,2021-03-27,Mobilität,Platzstreit in Deutschlands Städten Fahrrad sucht Weg,Der Spiegel,0.8,n/a
468,https://www.spiegel.de/politik/deutschland/gierige-abgeordnete-von-cdu-und-csu-in-der-coronakrise-gefaehrden-der-ruf-der-union-als-wirtschaftspartei-a-7a669f8a-0002-0001-0000-000176746211,corona korruption wirtschaftspartei,False,2021-03-27,Politik,Corona und Korruption Unsere Wirtschaftspartei,Der Spiegel,1.0,n/a
470,https://www.spiegel.de/politik/ausland/syrien-baschar-al-assad-beliefert-libanon-mit-sauerstoff-wegen-corona-welche-motive-stecken-dahinter-a-0d1623f4-d353-41ca-9100-93b5c951256e,syrien unterstützen libanon assads sauerstoff deal,False,2021-03-27,Politik,Syrien unterstützt den Libanon Assads Sauerstoff Deal,Der Spiegel,0.6666666666666666,n/a
471,https://www.spiegel.de/politik/deutschland/corona-politik-notbremse-osterruhe-gottvertrauen-die-staerksten-o-toene-dieser-chaoswoche-a-5c2c73ad-2647-4186-9e13-c7350e33bd95,krisenpolitik groß corona heckmeck,False,2021-03-27,Politik,Krisenpolitik Der große Corona Heckmeck,Der Spiegel,1.0,n/a
473,https://www.spiegel.de/politik/deutschland/coronavirus-fragerunde-zum-schutz-vor-corona-infektionen-livestream-a-271689df-a3b4-4fe4-a6d5-1478af1de448,bürgerbefragung jens spahn sollen impfungen selbsttests wissen,False,2021-03-27,Politik,Bürgerbefragung mit Jens Spahn Das sollten Sie über Impfungen und Selbsttests wissen,Der Spiegel,1.0,n/a
474,https://www.spiegel.de/wirtschaft/service/mark-branson-kann-der-neue-bafin-chef-die-verbraucher-besser-schuetzen-kolumne-a-bdddcd2f-31d1-4f40-bfc6-00083117df2e,mark branson neue bafin chef verbraucher gut schützen,False,2021-03-27,Wirtschaft,Mark Branson Kann der neue Bafin Chef die Verbraucher besser schützen,Der Spiegel,0.75,n/a
475,https://www.spiegel.de/wirtschaft/soziales/usa-und-die-1400-dollar-corona-schecks-wohin-mit-dem-geld-vom-staat-a-8a7ee63a-e74a-49d6-a74b-58a75f2a89d0,1400 dollar schecks usa wohin geld staat,False,2021-03-27,Wirtschaft,1400 Dollar Schecks in den USA Wohin mit dem Geld vom Staat,Der Spiegel,0.7142857142857143,n/a
476,https://www.spiegel.de/politik/deutschland/corona-schnelltest-taskforce-von-jens-spahn-und-andreas-scheuer-beim-testen-durchgefallen-a-a8abfa76-cb7b-42e5-9c24-e0e810f13445,taskforce spahn scheuer beim testen durchfallen,False,2021-03-27,Politik,Taskforce von Spahn und Scheuer Beim Testen durchgefallen,Der Spiegel,1.0,n/a
477,https://www.spiegel.de/gesundheit/diagnose/israel-wie-die-impfkampagne-das-land-von-corona-befreit-sinkende-fallzahlen-trotz-lockerungen-a-5e08a9ab-408c-402d-ada1-9a72d02c1927,offen restaurants sinkend fallzahlen impfkampagne israel corona befreien,False,2021-03-27,Gesundheit,Offene Restaurants sinkende Fallzahlen Wie die Impfkampagne Israel von Corona befreit,Der Spiegel,1.0,n/a
478,https://www.spiegel.de/wissenschaft/mensch/corona-was-ueber-die-p-1-mutationen-bekannt-ist-a-f537225a-05bc-4779-a63c-e399a95af071,folgen p1 variante pandemie amazonas mutation vormarsch,False,2021-03-27,Wissenschaft,Folgen der P1 Variante für die Pandemie Amazonas Mutation auf dem Vormarsch,Der Spiegel,1.0,n/a
480,https://www.spiegel.de/kultur/chinas-aufstieg-kein-spaziergang-fuer-den-westen-kolumne-a-8418e97c-0a24-41cc-aec0-545827765b8b,chinas aufsteigen europa niedergang verdienen,False,2021-03-27,Kultur,Chinas Aufstieg Europa hat seinen Niedergang verdient,Der Spiegel,0.6,n/a
481,https://www.spiegel.de/wirtschaft/kloster-verkauft-mehr-als-zwei-tonnen-kaese-in-online-challenge-a-e9f63853-02dc-44b7-8244-706a6a4d60d6,absatzeinbruch wegen corona kloster verkaufen mehr zwei tonnen käse online challenge,False,2021-03-27,Wirtschaft,Nach Absatzeinbruch wegen Corona Kloster verkauft mehr als zwei Tonnen Käse in Online Challenge,Der Spiegel,1.0,n/a
482,https://www.spiegel.de/netzwelt/web/woran-sie-fake-bewertungen-im-internet-erkennen-koennen-a-bab935ac-5616-4b66-b973-cd1dabab3509,rezensionen amazon co woran fake bewertungen internet erkennen,False,2021-03-27,Netzwelt,Rezensionen bei Amazon und Co Woran Sie Fake Bewertungen im Internet erkennen können,Der Spiegel,0.75,n/a
484,https://www.spiegel.de/politik/ausland/bristol-proteste-gegen-polizeigesetz-zehn-festnahmen-nach-weiterer-chaotischer-nacht-a-c4c97f98-761e-4491-bf49-deae95e6052f,proteste polizeigesetz zehn festnahmen weit chaosnacht bristol,False,2021-03-27,Politik,Proteste gegen Polizeigesetz Zehn Festnahmen nach weiterer Chaosnacht in Bristol,Der Spiegel,0.5714285714285714,n/a
485,https://www.spiegel.de/panorama/gesellschaft/corona-wie-senioren-unter-der-pandemie-leiden-a-00a0470c-32aa-4c88-9019-6b18364ffe34,alt pandemie bisschen klönen gerade tief,False,2021-03-27,Panorama,Alte in der Pandemie Können wir ein bisschen klönen Ich habe gerade so ein Tief,Der Spiegel,1.0,n/a
489,https://www.spiegel.de/wissenschaft/technik/linguistik-in-hannover-wird-angeblich-das-korrekteste-deutsch-gesprochen-a-3d9351d7-eea2-47ce-8380-11a774329656,sprachwissenschaft wer sprechen rein hochdeutsch,False,2021-03-27,Wissenschaft,Sprachwissenschaft Wer spricht das reinste Hochdeutsch,Der Spiegel,0.6,n/a
491,https://www.spiegel.de/panorama/bilder-der-woche-12-21-von-ziegen-lernen-heisst-siegen-lernen-a-70bb6b17-b29d-4833-b8a2-ef3cacaf9ad9,bilder woche ziegen lernen heißen siegen lernen,False,2021-03-27,Panorama,Bilder der Woche Von Ziegen lernen heißt siegen lernen,Der Spiegel,0.8571428571428571,n/a
492,https://www.spiegel.de/politik/ausland/kamala-harris-und-die-fluechtlingskrise-in-den-usa-feuerprobe-fuer-die-vizepraesidentin-a-ed0f02a0-aebf-457a-86d3-d34b9ecf82cc,flüchtlingskrise usa feuerprobe kamala harris,False,2021-03-27,Politik,Flüchtlingskrise in den USA Feuerprobe für Kamala Harris,Der Spiegel,0.6,n/a
495,https://www.spiegel.de/politik/ausland/myanmar-militaerregierung-schiesst-auf-demonstranten-16-menschen-sterben-a-6f9513ef-de24-48a2-9980-3d39c3020cf8,myanmar militärregierung schießen demonstranten mindestens 60 menschen sterben,False,2021-03-27,Politik,Myanmar Militärregierung schießt auf Demonstranten   mindestens 60 Menschen sterben,Der Spiegel,0.875,n/a
496,https://www.spiegel.de/politik/deutschland/bodo-ramelow-schildert-die-ereignisse-der-bund-laender-konferenzen-a-29408805-a03d-4f06-b1da-d5b2ecd16ce6,thüringens ministerpräsident osterdebakel schiefgelaufen herr ramelow,False,2021-03-27,Politik,Thüringens Ministerpräsident über das Osterdebakel Was ist da schiefgelaufen Herr Ramelow,Der Spiegel,0.6666666666666666,n/a
497,https://www.spiegel.de/politik/ausland/25-jahres-plan-iran-und-china-schmieden-enge-wirtschafts-kooperation-a-e6ab7285-37bf-46f0-8073-3a1c5f772140,strategische zusammenarbeit iran china schmieden eng wirtschaftskooperation,False,2021-03-27,Politik,Strategische Zusammenarbeit Iran und China schmieden enge Wirtschaftskooperation,Der Spiegel,0.5714285714285714,n/a
498,https://www.spiegel.de/wirtschaft/mehr-privatsphaere-deutsche-bahn-plant-rueckkehr-zu-abteilen-a-2fa89a41-cc71-4c85-94cb-da2cdc37577a,mehr privatsphäre deutsch bahn planen rückkehr abteilen,False,2021-03-27,Wirtschaft,Mehr Privatsphäre Deutsche Bahn plant Rückkehr zu Abteilen,Der Spiegel,0.7142857142857143,n/a
499,https://www.spiegel.de/politik/deutschland/news-jens-spahn-masken-affaeren-corona-katastrophe-in-brasilien-a-a6b03759-3f57-4709-8d02-65c61a2b6d7d,lage morgen jens spahn telefon papstes,False,2021-03-27,Politik,Die Lage am Morgen Jens Spahn und das Telefon des Papstes,Der Spiegel,1.0,n/a
501,https://www.spiegel.de/wissenschaft/medizin/corona-news-am-samstag-die-wichtigsten-entwicklungen-zu-sars-cov-2-und-covid-19-a-4eda0df2-5709-4257-a49e-862ee33d91ec,corona news 27 märz berlin verpflichten unternehmen homeoffice tests,False,2021-03-27,Wissenschaft, Corona News am 27 März  Berlin verpflichtet Unternehmen zu Homeoffice und Tests,Der Spiegel,1.0,n/a
502,https://www.spiegel.de/politik/ausland/georgia-joe-biden-verurteilt-wahlrechtsreform-als-diskriminierung-von-afroamerikanern-a-0780eb43-a04b-4b1d-a0ce-f4f6f9d6cb8d,neu gesetz us bundesstaat georgia biden verurteilen wahlrechtsreform diskriminierung afroamerikanern,False,2021-03-27,Politik,Neues Gesetz im US Bundesstaat Georgia Biden verurteilt Wahlrechtsreform als Diskriminierung von Afroamerikanern,Der Spiegel,0.7,n/a
503,https://www.spiegel.de/politik/deutschland/wochenrueckblick-merkels-entschuldigung-eu-und-impfdesaster-missbrauch-in-der-katholischen-kirche-podcast-a-277173fd-fbc6-4016-a3b9-4206295b51ef,spiegel daily podcast wochenrückblick merkels entschuldigung eu impfdesaster missbrauch katholisch kirche,False,2021-03-27,Politik,SPIEGEL Daily Podcast Wochenrückblick Merkels Entschuldigung EU und das Impfdesaster Missbrauch in der katholischen Kirche,Der Spiegel,0.5454545454545454,n/a
504,https://www.spiegel.de/politik/ausland/corona-weltgesundheitsorganisation-who-bittet-um-impfdosen-fuer-aermere-laender-a-b46805aa-6e5a-4bd1-b661-af35ec26715f,coronapandemie who bitten impfdosen arm länder,False,2021-03-27,Politik,Coronapandemie WHO bittet um Impfdosen für ärmere Länder,Der Spiegel,1.0,n/a
505,https://www.spiegel.de/wirtschaft/corona-impfung-welches-bundesland-impft-wie-und-in-welcher-reihenfolge-a-3f811822-212e-44ae-a8fc-44b98d61ebaa,impfchaos deutschland postleitzahl entscheiden darüber groß risiko,False,2021-03-27,Wirtschaft,Impfchaos in Deutschland Die Postleitzahl entscheidet darüber wie groß das Risiko ist,Der Spiegel,0.7142857142857143,n/a
506,https://www.spiegel.de/wirtschaft/usa-was-joe-bidens-konjunkturpaket-fuer-europa-und-die-welt-bedeutet-a-214918ae-43b5-48fc-8b82-1c3884597f1c,us haushaltsdefizit rückkehr pump kapitalismus,False,2021-03-27,Wirtschaft,US Haushaltsdefizit Die Rückkehr des Pump Kapitalismus,Der Spiegel,0.6,n/a
510,https://www.spiegel.de/panorama/gesellschaft/corona-lage-in-altenheimen-geimpft-aber-das-leben-ist-noch-lange-nicht-normal-a-5f90447b-0002-0001-0000-000176746229,coronalage altenheimen senioren impfen leben lang normal,False,2021-03-27,Panorama,Coronalage in Altenheimen Die Senioren sind geimpft aber ihr Leben ist noch lange nicht normal,Der Spiegel,1.0,n/a
515,https://www.spiegel.de/politik/deutschland/anne-will-merkel-draengt-laender-zu-haerterem-corona-kurs-a-d3cc0c39-dddf-43cb-8711-7a3564bd81a1,bundeskanzlerin anne merkel drängen länder hart coronakurs,False,2021-03-28,Politik,Bundeskanzlerin bei Anne Will Merkel drängt Länder zu härterem Coronakurs,Der Spiegel,1.0,n/a
518,https://www.spiegel.de/politik/ausland/coronakrise-in-der-slowakei-regierungschef-will-posten-mit-finanzminister-tauschen-a-7f29a86d-559a-4b4a-b945-15cca70e25a3,streit coronapolitik slowakischer regierungschef posten finanzminister tauschen,False,2021-03-28,Politik,Streit über Coronapolitik Slowakischer Regierungschef will Posten mit Finanzminister tauschen,Der Spiegel,0.7142857142857143,n/a
521,https://www.spiegel.de/politik/ausland/rassismus-in-den-usa-der-fall-des-negro-creek-in-kansas-a-7f44b84d-04cb-410f-8e37-016558d4417e,negro creek us bundesstaat kansas kleine bach böse namen,False,2021-03-28,Politik,Negro Creek im US Bundesstaat Kansas Der kleine Bach mit dem bösen Namen,Der Spiegel,0.5555555555555556,n/a
524,https://www.spiegel.de/panorama/osterferien-beginn-tausende-fliegen-nach-mallorca-autobahnen-bleiben-frei-a-0c4c7a77-765b-4e8e-b6b4-c78c785c80d2,osterferienbeginn tausende fliegen mallorca autobahnen bleiben frei,False,2021-03-28,Panorama,Osterferienbeginn Tausende fliegen nach Mallorca   Autobahnen bleiben frei,Der Spiegel,0.7142857142857143,n/a
525,https://www.spiegel.de/kultur/literatur/debatte-um-klasse-her-mit-den-empoerungsromanen-a-662701de-116f-45e7-b50a-b36dc50b1d8b,debatte klasse her empörungsromanen,False,2021-03-28,Kultur,Debatte über Klasse Her mit den Empörungsromanen,Der Spiegel,0.75,n/a
528,https://www.spiegel.de/panorama/wut-in-den-niederlanden-kirchenbesucher-greifen-journalisten-an-a-9b186cb2-45d3-4744-b073-b7c3b9b68cb5,wut niederlanden kirchenbesucher greifen journalisten,False,2021-03-28,Panorama,Wut in den Niederlanden Kirchenbesucher greifen Journalisten an,Der Spiegel,0.8,n/a
529,https://www.spiegel.de/panorama/new-york-steht-kurz-vor-der-legalisierung-von-cannabis-a-ab99be97-7b3e-4d9d-9258-bd8f2dc14819,15 bundesstaat new york stehen kurz legalisierung cannabis,False,2021-03-28,Panorama,15 Bundesstaat New York steht kurz vor der Legalisierung von Cannabis,Der Spiegel,0.75,n/a
533,https://www.spiegel.de/politik/ausland/explosion-in-indonesien-mindestens-14-verletzte-bei-mutmasslichem-bombenanschlag-auf-kirche-a-4e9b75f6-e409-4121-897f-e3828760de81,explosion indonesien mindestens 14 verletzen mutmaßlich bombenanschlag kirche,False,2021-03-28,Politik,Explosion in Indonesien Mindestens 14 Verletzte bei mutmaßlichem Bombenanschlag auf Kirche,Der Spiegel,0.75,n/a
536,https://www.spiegel.de/wissenschaft/medizin/corona-impfstoff-hausaerztin-impft-in-ihrer-praxis-a-65592ead-03ac-4489-953e-9c67d49dec14,impfen hausarztpraxis tränen augen,False,2021-03-28,Wissenschaft,Impfen in der Hausarztpraxis Da hat man Tränen in den Augen,Der Spiegel,1.0,n/a
541,https://www.spiegel.de/panorama/zeitumstellung-im-britischen-parlament-das-haus-der-2000-uhren-a-367ff58a-9448-48f2-b5a4-3ee570c5ba90,kurios zeitumstellung britisch parlament wer uhr drehen parlamentspräsident,False,2021-03-28,Panorama,Kuriose Zeitumstellung im britischen Parlament Wer hat an der Uhr gedreht Der Parlamentspräsident,Der Spiegel,0.625,n/a
544,https://www.spiegel.de/politik/ausland/italien-der-kampf-der-muetter-aus-der-roten-zone-von-venetien-gegen-umweltverschmutzung-a-f35e997b-b6d7-4aef-bac2-9db7bcdf7214,umweltverschmutzung italien kampf mütter rot zone,False,2021-03-28,Politik,Umweltverschmutzung in Italien Der Kampf der Mütter aus der roten Zone,Der Spiegel,0.6666666666666666,n/a
545,https://www.spiegel.de/politik/ausland/corona-impfstoffe-transportieren-eine-logistische-mammutaufgabe-a-eb645d1f-dedb-4029-b473-74500073b80f,anruf firma kühlsysteme geben fälle impfdosen bierkühlern transportieren werden,False,2021-03-28,Politik,Anruf bei einer Firma für Kühlsysteme Es gab Fälle da sind Impfdosen in Bierkühlern transportiert worden,Der Spiegel,0.5555555555555556,n/a
546,https://www.spiegel.de/wirtschaft/corona-krise-warum-die-angst-vor-inflation-berechtigt-ist-kolumne-a-559359c6-f5ba-4cec-8ad9-dd4089e90f8f,unsicherheit coronakrise warum angst inflation berechtigen,False,2021-03-28,Wirtschaft,Unsicherheit in der Coronakrise Warum die Angst vor Inflation berechtigt ist,Der Spiegel,1.0,n/a
548,https://www.spiegel.de/politik/ausland/nikol-paschinjan-armeniens-ministerpraesident-kuendigt-ruecktritt-an-a-1f5c3483-cee1-4749-8b05-927f0e056287,bergkarabach konflikt armeniens ministerpräsident kündigen rücktritt,False,2021-03-28,Politik,Bergkarabach Konflikt Armeniens Ministerpräsident kündigt Rücktritt an,Der Spiegel,0.6666666666666666,n/a
549,https://www.spiegel.de/politik/ausland/corona-in-indien-beistand-bieten-nur-die-goetter-a-b2d88efb-67b5-454b-9f13-cdf4ab649de5,jahr corona indien beistehen bieten götter,False,2021-03-28,Politik,Ein Jahr Corona in Indien Beistand bieten nur die Götter,Der Spiegel,1.0,n/a
551,https://www.spiegel.de/politik/deutschland/neuer-lockdown-laender-streiten-ueber-die-notbremse-und-ein-naechstes-treffen-noch-vor-ostern-a-58b98274-511a-49cc-94ab-56648632a94f,coronakrise länder streiten notbremse treffen ostern,False,2021-03-28,Politik,Coronakrise Länder streiten über die Notbremse   und ein Treffen noch vor Ostern,Der Spiegel,1.0,n/a
553,https://www.spiegel.de/politik/ausland/china-im-streit-um-die-uiguren-verhaengt-das-land-sanktionen-gegen-vertreter-aus-den-usa-und-kanada-a-4d728aa3-1f70-4245-a9dc-5d5b65f8d3b0,streit uiguren china verhängen sanktionen vertreter usa kanada,False,2021-03-28,Politik,Streit über Uiguren China verhängt Sanktionen gegen Vertreter aus den USA und Kanada,Der Spiegel,0.875,n/a
555,https://www.spiegel.de/geschichte/deutscher-kolonialismus-in-afrika-wo-steckt-der-kopf-des-mangi-meli-a-1e5ab093-222a-4453-93d3-597e8aea417c,deutsch kolonialismus afrika stecken kopf mangi meli,False,2021-03-28,Geschichte,Deutscher Kolonialismus in Afrika Wo steckt der Kopf des Mangi Meli,Der Spiegel,0.5714285714285714,n/a
559,https://www.spiegel.de/politik/deutschland/ost-west-wanderung-neue-bundeslaender-werden-attraktiver-und-verlieren-dennoch-einwohner-an-den-westen-a-08a63688-be42-4188-bcab-3cb934f120da,ost west wanderung neue bundesländer attraktiv verlieren dennoch einwohner westen,False,2021-03-28,Politik,Ost West Wanderung Neue Bundesländer werden attraktiver   und verlieren dennoch Einwohner an den Westen,Der Spiegel,0.7,n/a
561,https://www.spiegel.de/politik/oesterreichs-wiener-zeitung-die-aelteste-tageszeitung-der-welt-ist-in-gefahr-a-5231412f-17ea-434c-8573-df2b07f47434,alt tageszeitung welt wiener zeitung kämpfen ums überleben,False,2021-03-28,Politik,Älteste Tageszeitung der Welt Die Wiener Zeitung kämpft ums Überleben,Der Spiegel,0.75,n/a
563,https://www.spiegel.de/politik/ausland/brasilien-jair-bolsonaro-nutzt-die-corona-krise-um-die-demokratie-abzuwickeln-a-5b2e14ba-58cf-432f-a3bb-effc0e6c27a9,jair bolsonaro führen brasilien katastrophe stoppen mann,False,2021-03-28,Politik,Jair Bolsonaro führt Brasilien in die Katastrophe Stoppt diesen Mann,Der Spiegel,1.0,n/a
564,https://www.spiegel.de/panorama/gesellschaft/beduerftige-im-lockdown-die-ein-oder-andere-familie-wird-jetzt-kraeftig-ins-schwitzen-geraten-a-80cd9591-4e03-41a0-a458-6fb4c93dcd7e,bedürftige verpatzen oster lockdown politik vergessen menschen monatsbeginn einkaufen gehen müssen,False,2021-03-28,Panorama,Bedürftige und der verpatzte Oster Lockdown Die Politik hat vergessen dass diese Menschen zum Monatsbeginn einkaufen gehen müssen,Der Spiegel,1.0,n/a
568,https://www.spiegel.de/politik/ausland/myanmar-gewalt-des-militaers-gegen-protestbewegung-eskaliert-a-51442f34-bd82-4241-b231-aa47a0b43902,myanmar ende menschlichkeit,False,2021-03-28,Politik,Myanmar Das Ende der Menschlichkeit,Der Spiegel,0.6666666666666666,n/a
569,https://www.spiegel.de/wirtschaft/anstieg-der-sparguthaben-deutsche-horten-in-der-pandemie-rekordsummen-a-9bf3e632-3650-49fa-98ea-a5fa3d7813f4,ansteigen sparguthaben deutsch horten pandemie rekordsummen,False,2021-03-28,Wirtschaft,Anstieg der Sparguthaben Deutsche horten in der Pandemie Rekordsummen,Der Spiegel,1.0,n/a
571,https://www.spiegel.de/wissenschaft/medizin/coronavirus-news-inzidenz-in-deutschland-steigt-auf-knapp-130-a-a6d49e12-6271-4a3b-8237-a0e7732b338f,corona news 28 märz paul ziemiak flexibel impfreihenfolge,False,2021-03-28,Wissenschaft,Corona News am 28 März Paul Ziemiak für flexiblere Impfreihenfolge,Der Spiegel,1.0,n/a
573,https://www.spiegel.de/panorama/corona-comeback-briten-entdecken-den-tee-wieder-a-91db04a4-f5fc-4929-b209-db61831fa4ab,corona comeback briten entdecken tee,False,2021-03-28,Panorama,Corona Comeback Briten entdecken den Tee wieder,Der Spiegel,1.0,n/a
574,https://www.spiegel.de/panorama/grosseinsatz-in-hessen-mann-feuert-schuss-im-zug-ab-a-a5cfde3f-dbc7-494e-9b19-75d93321d47b,großeinsatz hessen mann feuern schuss zug ab,False,2021-03-28,Panorama,Großeinsatz in Hessen Mann feuert Schuss im Zug ab,Der Spiegel,0.5714285714285714,n/a
576,https://www.spiegel.de/politik/ausland/lesbos-neues-fluechtlingslager-auf-lesbos-wird-nicht-rechtzeitig-fertig-a-84116738-f80a-4608-8ec3-61f09d89f56c,unterbringung geflüchteten neu lager lesbos rechtzeitig fertigen,False,2021-03-28,Politik,Unterbringung von Geflüchteten Neues Lager auf Lesbos wird nicht rechtzeitig fertig,Der Spiegel,0.5714285714285714,n/a
577,https://www.spiegel.de/politik/deutschland/neuer-lockdown-tagt-die-naechste-bund-laender-runde-noch-vor-ostern-a-4a69ce20-8259-40f1-90d1-b028374d6347,neu lockdown tagen nächst bund länder runden ostern,False,2021-03-28,Politik,Neuer Lockdown Tagt die nächste Bund Länder Runde noch vor Ostern,Der Spiegel,1.0,n/a
582,https://www.spiegel.de/politik/ausland/usa-joe-biden-will-das-corona-impftempo-nochmals-erhoehen-a-e28684db-6f51-417a-9c88-471b867b514f,coronakrise usa rennen leben tod biden impftempo nochmals erhöhen,False,2021-03-29,Politik,Coronakrise in den USA Rennen um Leben und Tod   Biden will Impftempo nochmals erhöhen,Der Spiegel,0.7777777777777778,n/a
